{
  "schema_version": 1,
  "updated_at": "2026-08-09",
  "purpose": "Small deterministic fixture.",
  "status_definitions": {
    "raw": "Raw",
    "validating": "Validating",
    "parked": "Parked",
    "passed_scope": "Passed scope",
    "passed_market": "Passed market",
    "needs_reconstruction": "Needs reconstruction"
  },
  "ideas": [
    {
      "id": "fixture-idea",
      "name": "Fixture Idea",
      "aliases": ["Fixture"],
      "status": "validating",
      "hackathon_fit": "high",
      "one_liner": "Exercise the deterministic generator.",
      "decision_reason": "The fixture remains useful for validation.",
      "resurrection_trigger": "Pass ten deterministic builds.",
      "tags": ["testing", "generator"],
      "research": ["docs/RESEARCH.md"]
    }
  ]
}
